{
  "schema_version": 1,
  "gerado_em": "2026-09-29T06:12:00-03:00",
  "dia_alvo_d0": "2026-09-29",
  "municipios_sem_dados": [],
  "municipios": [
    {
      "ibge": "4206900",
      "nome": "Ibirama",
      "limiar_mm": 150,
      "fonte_limiar": "VIGIA, limiar provisório definido pela equipe (abaixo do hipotético de 250 mm do GeoRisk)",
      "mv_h": 24,
      "dias": [
        {
          "dia_alvo": "2026-09-29",
          "d": 0,
          "indice": 2.2413,
          "classe": 5,
          "efr_mm": 210.4,
          "rtotal_mm": 125.8,
          "n_membros": 24,
          "prob": {
            "pontuais": 0.65,
            "esparsos": 0.36,
            "generalizados": 0.12
          }
        },
        {
          "dia_alvo": "2026-09-30",
          "d": 1,
          "indice": 1.4687,
          "classe": 4,
          "efr_mm": 180.2,
          "rtotal_mm": 40.1,
          "n_membros": 24,
          "prob": {
            "pontuais": 0.49,
            "esparsos": 0.23,
            "generalizados": 0.05
          }
        },
        {
          "dia_alvo": "2026-10-01",
          "d": 2,
          "indice": 0.89,
          "classe": 3,
          "efr_mm": 121.5,
          "rtotal_mm": 12,
          "n_membros": 24,
          "prob": {
            "pontuais": 0.38,
            "esparsos": 0.14,
            "generalizados": 0.02
          }
        },
        {
          "dia_alvo": "2026-10-02",
          "d": 3,
          "indice": 0.5587,
          "classe": 2,
          "efr_mm": 80.3,
          "rtotal_mm": 3.5,
          "n_membros": 18,
          "prob": {
            "pontuais": 0.31,
            "esparsos": 0.09,
            "generalizados": 0.01
          }
        }
      ],
      "historico": [
        {
          "dia_alvo": "2026-09-14",
          "indice": 0.3,
          "classe": 1
        },
        {
          "dia_alvo": "2026-09-15",
          "indice": 0.3868,
          "classe": 1
        },
        {
          "dia_alvo": "2026-09-16",
          "indice": 0.37,
          "classe": 1
        },
        {
          "dia_alvo": "2026-09-17",
          "indice": 0.308,
          "classe": 1
        },
        {
          "dia_alvo": "2026-09-18",
          "indice": 0.344,
          "classe": 1
        },
        {
          "dia_alvo": "2026-09-19",
          "indice": 0.49,
          "classe": 2
        },
        {
          "dia_alvo": "2026-09-20",
          "indice": 0.619,
          "classe": 2
        },
        {
          "dia_alvo": "2026-09-21",
          "indice": 0.6617,
          "classe": 2
        },
        {
          "dia_alvo": "2026-09-22",
          "indice": 0.6998,
          "classe": 2
        },
        {
          "dia_alvo": "2026-09-23",
          "indice": 0.8275,
          "classe": 3
        },
        {
          "dia_alvo": "2026-09-24",
          "indice": 1.0145,
          "classe": 4
        },
        {
          "dia_alvo": "2026-09-25",
          "indice": 1.1752,
          "classe": 4
        },
        {
          "dia_alvo": "2026-09-26",
          "indice": 1.3065,
          "classe": 4
        },
        {
          "dia_alvo": "2026-09-27",
          "indice": 1.4677,
          "classe": 4
        },
        {
          "dia_alvo": "2026-09-28",
          "indice": 1.6667,
          "classe": 4
        }
      ],
      "chuva_acum_mm": {
        "24h": 96.4,
        "48h": 148.2,
        "72h": 171,
        "96h": 182.6
      }
    },
    {
      "ibge": "4214003",
      "nome": "Presidente Getúlio",
      "limiar_mm": 150,
      "fonte_limiar": "VIGIA, limiar provisório definido pela equipe (abaixo do hipotético de 250 mm do GeoRisk)",
      "mv_h": 24,
      "dias": [
        {
          "dia_alvo": "2026-09-29",
          "d": 0,
          "indice": 3.2067,
          "classe": 6,
          "efr_mm": 262.7,
          "rtotal_mm": 218.3,
          "n_membros": 24,
          "prob": {
            "pontuais": 0.84,
            "esparsos": 0.51,
            "generalizados": 0.25
          }
        },
        {
          "dia_alvo": "2026-09-30",
          "d": 1,
          "indice": 1.7833,
          "classe": 4,
          "efr_mm": 214.9,
          "rtotal_mm": 52.6,
          "n_membros": 24,
          "prob": {
            "pontuais": 0.56,
            "esparsos": 0.29,
            "generalizados": 0.08
          }
        },
        {
          "dia_alvo": "2026-10-01",
          "d": 2,
          "indice": 1.0373,
          "classe": 4,
          "efr_mm": 140.2,
          "rtotal_mm": 15.4,
          "n_membros": 24,
          "prob": {
            "pontuais": 0.41,
            "esparsos": 0.17,
            "generalizados": 0.03
          }
        },
        {
          "dia_alvo": "2026-10-02",
          "d": 3,
          "indice": 0.6273,
          "classe": 2,
          "efr_mm": 90.1,
          "rtotal_mm": 4,
          "n_membros": 18,
          "prob": {
            "pontuais": 0.33,
            "esparsos": 0.1,
            "generalizados": 0.01
          }
        }
      ],
      "historico": [
        {
          "dia_alvo": "2026-09-14",
          "indice": 0.3702,
          "classe": 1
        },
        {
          "dia_alvo": "2026-09-15",
          "indice": 0.371,
          "classe": 1
        },
        {
          "dia_alvo": "2026-09-16",
          "indice": 0.3003,
          "classe": 1
        },
        {
          "dia_alvo": "2026-09-17",
          "indice": 0.3038,
          "classe": 1
        },
        {
          "dia_alvo": "2026-09-18",
          "indice": 0.4392,
          "classe": 2
        },
        {
          "dia_alvo": "2026-09-19",
          "indice": 0.5957,
          "classe": 2
        },
        {
          "dia_alvo": "2026-09-20",
          "indice": 0.6673,
          "classe": 2
        },
        {
          "dia_alvo": "2026-09-21",
          "indice": 0.7068,
          "classe": 3
        },
        {
          "dia_alvo": "2026-09-22",
          "indice": 0.8307,
          "classe": 3
        },
        {
          "dia_alvo": "2026-09-23",
          "indice": 1.0435,
          "classe": 4
        },
        {
          "dia_alvo": "2026-09-24",
          "indice": 1.2503,
          "classe": 4
        },
        {
          "dia_alvo": "2026-09-25",
          "indice": 1.4137,
          "classe": 4
        },
        {
          "dia_alvo": "2026-09-26",
          "indice": 1.593,
          "classe": 4
        },
        {
          "dia_alvo": "2026-09-27",
          "indice": 1.8283,
          "classe": 5
        },
        {
          "dia_alvo": "2026-09-28",
          "indice": 2.0833,
          "classe": 5
        }
      ],
      "chuva_acum_mm": {
        "24h": 118,
        "48h": 176.5,
        "72h": 201.3,
        "96h": 215.8
      }
    },
    {
      "ibge": "4209151",
      "nome": "José Boiteux",
      "limiar_mm": 150,
      "fonte_limiar": "VIGIA, limiar provisório definido pela equipe (abaixo do hipotético de 250 mm do GeoRisk)",
      "mv_h": 24,
      "dias": [
        {
          "dia_alvo": "2026-09-29",
          "d": 0,
          "indice": 1.5653,
          "classe": 4,
          "efr_mm": 150.2,
          "rtotal_mm": 84.6,
          "n_membros": 24,
          "prob": {
            "pontuais": 0.51,
            "esparsos": 0.25,
            "generalizados": 0.06
          }
        },
        {
          "dia_alvo": "2026-09-30",
          "d": 1,
          "indice": 1.056,
          "classe": 4,
          "efr_mm": 128,
          "rtotal_mm": 30.4,
          "n_membros": 24,
          "prob": {
            "pontuais": 0.41,
            "esparsos": 0.17,
            "generalizados": 0.03
          }
        },
        {
          "dia_alvo": "2026-10-01",
          "d": 2,
          "indice": 0.6547,
          "classe": 2,
          "efr_mm": 88.4,
          "rtotal_mm": 9.8,
          "n_membros": 24,
          "prob": {
            "pontuais": 0.33,
            "esparsos": 0.1,
            "generalizados": 0.01
          }
        },
        {
          "dia_alvo": "2026-10-02",
          "d": 3,
          "indice": 0.4153,
          "classe": 2,
          "efr_mm": 60.2,
          "rtotal_mm": 2.1,
          "n_membros": 18,
          "prob": {
            "pontuais": 0.28,
            "esparsos": 0.07,
            "generalizados": 0
          }
        }
      ],
      "historico": [
        {
          "dia_alvo": "2026-09-14",
          "indice": 0.3758,
          "classe": 1
        },
        {
          "dia_alvo": "2026-09-15",
          "indice": 0.2918,
          "classe": 1
        },
        {
          "dia_alvo": "2026-09-16",
          "indice": 0.2383,
          "classe": 1
        },
        {
          "dia_alvo": "2026-09-17",
          "indice": 0.3138,
          "classe": 1
        },
        {
          "dia_alvo": "2026-09-18",
          "indice": 0.4383,
          "classe": 2
        },
        {
          "dia_alvo": "2026-09-19",
          "indice": 0.4792,
          "classe": 2
        },
        {
          "dia_alvo": "2026-09-20",
          "indice": 0.4495,
          "classe": 2
        },
        {
          "dia_alvo": "2026-09-21",
          "indice": 0.4753,
          "classe": 2
        },
        {
          "dia_alvo": "2026-09-22",
          "indice": 0.6008,
          "classe": 2
        },
        {
          "dia_alvo": "2026-09-23",
          "indice": 0.7368,
          "classe": 3
        },
        {
          "dia_alvo": "2026-09-24",
          "indice": 0.8112,
          "classe": 3
        },
        {
          "dia_alvo": "2026-09-25",
          "indice": 0.8687,
          "classe": 3
        },
        {
          "dia_alvo": "2026-09-26",
          "indice": 0.977,
          "classe": 3
        },
        {
          "dia_alvo": "2026-09-27",
          "indice": 1.1197,
          "classe": 4
        },
        {
          "dia_alvo": "2026-09-28",
          "indice": 1.25,
          "classe": 4